year,japanese,english,publisher,image,product_type
1993,真・女神転生RPG基本システム,Shin Megami Tensei RPG Basic System,ASCII,new_goddess_reincarnation_1.jpg,rulebook
1994,真・女神転生RPG世紀末サバイバル・ガイド ,Shin Megami Tensei RPG End of the Century Survival Guide,Aspect,new_goddess_reincarnation_1_end_of_century_survival_guide.jpg,supplement
1994,魔性の傀儡 真・女神転生RPGリプレイ ,Evil Puppet: Shin Megami Tensei RPG Replay,Aspect,new_goddess_reincarnation_1_replay.jpg,replay
1995,真・女神転生II TRPG誕生篇,Shin Megami Tensei II RPG Birth Edition,ASCII,new_goddess_reincarnation_2.jpg,rulebook
1995,紅蓮の夜 真・女神転生IITRPG誕生篇ジャンプスタート・キット,Night of the Lotus: Shin Megami Tensei II RPG Birth Edition Jump Start Kit,Aspect,new_goddess_reincarnation_2_jumpstart_kit.jpg,rulebook
1995,魔界の扉　真・女神転生IITRPGリプレイ ,Gate of Hell: Shin Megami Tensei II RPG Birth Edition Replay,Aspect,new_goddess_reincarnation_2_replay.jpg,replay
1996,金色の箱　真・女神転生IITRPGサプリメント,Golden Box: Shin Megami Tensei II RPG Birth Edition Supplement,ASCII,new_goddess_reincarnation_2_replay2.jpg,supplement
1996,八雲の狭霧　真・女神転生IITRPGリプレイ,Mists of Yakumo: Shin Megami Tensei II RPG Birth Edition Replay,ASCII,new_goddess_reincarnation_2_replay3.jpg,replay
1998,真・女神転生TRPG覚醒篇,Shin Megami Tensei RPG Awakening Edition,Aspect,new_goddess_reincarnation_3.jpg,rulebook
2002,業魔殿―真・女神転生TRPG覚醒篇サプリメント,Business Hall: Shin Megami Tensei RPG Awakening Edition Supplement,Suzaku Games,new_goddess_reincarnation_3_supplement.jpg,supplement
2004,真・女神転生3‐NOCTURNE TRPG 東京受胎,Shin Megami Tensei 3-NOCTURNE TRPG Tokyo conception,Jive,nocturne-rulebook.jpg,rulebook
2004,アマラ深界 真・女神転生3‐NOCTURNE TRPGサプリメント,Amara Deep World: Shin Megami Tensei 3-NOCTURNE TRPG Supplement,Jive,nocturne-supplement.jpg,supplement
2005,再会―See you again next world 真・女神転生3 NOCTURNE TRPGリプレイ,Reunion―See you again next world: Shin Megami Tensei 3 NOCTURNE TRPG Replay,Jive,nocturne-replay.jpg,replay
2005,真・女神転生TRPG　魔都東京200X,Shin Megami Tensei TRPG Magic City Tokyo 200X,Jive,200x-rulebook.jpg,rulebook
2006,金剛神界 真・女神転生TRPG魔都東京200Xサプリメント,Kongo Shinkai: Shin Megami Tensei TRPG Magic City Tokyo 200X Supplement,Jive,200x-magic-city-tokyo.jpg,supplement
2006,TOKYOミレニアム 真・女神転生TRPG魔都東京200Xサプリメント,Tokyo Millennium: Shin Megami Tensei TRPG Magic City Tokyo 200X Supplement,Jive,200x-tokyo-millenium.jpg,supplement
2007,セフィロトの魔界 真・女神転生TRPG魔都東京200Xサプリメント,Sephiroto's Makai: Shin Megami Tensei TRPG Magic City Tokyo 200X Supplement,Jive,200x-sephirots-hell.jpg,supplement
2007,闇のプロファイル 真・女神転生TRPG魔都東京200X,Profile of Darkness Shin Megami Tensei TRPG Magic City Tokyo 200X,Jive,200x-dark-profile.jpg,supplement
2008,ラグナロク 真・女神転生TRPG魔都東京200X,Ragnarok: Shin Megami Tensei TRPG Magic City Tokyo 200X,Jive,200x-ragnarok.jpg,supplement
2010,異形科学 －ストレンジ・サイエンス 真・女神転生TRPG 魔都東京200X,Variant Science-Strange Science Shin Megami Tensei TRPG Magic City Tokyo 200X,Jive,200x-variant-science.jpg,supplement