year,japanese,english,publisher,image
1991,ウオーハンマー―ファンタジーRPGルールブック〈1〉,Warhammer Fantasy RPG Rulebook 1,Shakaishisosha,warhammer_fantasy_1.jpg
1991,ウオーハンマー―ファンタジーRPGルールブック〈2〉,Warhammer Fantasy RPG Rulebook 2,Shakaishisosha,warhammer_fantasy_2.jpg
1991,ウオーハンマー―ファンタジーRPGルールブック〈3〉,Warhammer Fantasy RPG Rulebook 3,Shakaishisosha,warhammer_fantasy_3.jpg
1992,さまよえる魂 ウォーハンマーRPGシナリオ,Wandering Soul: Warhammer Fantasy RPG Scenario,Shakaishisosha,wandering_soul.jpg
1992,エンパイアの興亡『内なる敵』キャンペーン(1)ウォーハンマーRPGシナリオ,Empire's Rise and Fall: Inner Enemy Campaign 1: Warhammer Fantasy RPG Scenario,Shakaishisosha,empires_rise_and_fall.jpg
,死の街ベーゲンハーフェン『内なる敵』キャンペーン(2)ウォーハンマーRPGシナリオ,Begenhafen City of Death: Inner Enemy Campaign 2: Warhammer Fantasy RPG Scenario,Shakaishisosha,begenhafen_city_of_death.jpg
,ウォーハンマーファンタジーRPGゲームマスター・スクリーン,Warhammer Fantasy RPG Game Master Screen,Shakaishisosha,warhammer_fantasy_game_master_screen.jpg
1993,ウォーハンマーリプレイ(1) 破壊の剣,Warhammer Replay 1: Sword of Destruction,Shakaishisosha,warhammer_replay_1.jpg
1993,ウォーハンマーリプレイ(2)プラーグの妖術師,Warhammer Replay 2: Sorcerer of Prague,Shakaishisosha,warhammer_replay_2.jpg